,Time,Title,Description,Body
14,2023-03-02 02:38:00,"Moneycontrol Pro Panorama | Autos gain ground, but headwinds lurk","In today’s edition of Moneycontrol Pro Panorama: Market conditions ease up a bit, heat waves not a concern yet, states record tepid capex spending, no big farewell for Citibank, and more","Dear Reader,  The Panorama newsletter is sent to Moneycontrol Pro subscribers on market days. It offers easy access to stories published on Moneycontrol Pro and gives a little extra by setting out a context or an event or trend that investors should keep track of.  February wholesale data from auto original equipment makers (OEMs) saw rising demand across all segments. While the demand-led recovery has pushed sales growth in commercial vehicles (CV) and passenger vehicles (PV) beyond pre-COVID levels, there is optimism even in two-wheelers, which have been lagging compared to other segments. The domestic auto recovery is getting more broad-based although retail segment demand has been sustained mainly due to demand from the urban and higher-end customer. This is reflected in robust sales in utility vehicles (UVs), particularly in newly launched models. February PV registrations rose by about 10 per cent year-on-year (yoy) and were about 17 per cent higher than February of 2019 -- the year before the pandemic. Even the recent 1-2 per cent price hikes by leaders such as Maruti Suzuki, Tata Motors and Mahindra and Mahindra did not dampen sentiment. While two-wheelers were seeing improved off-take in premium bikes, February data brought some cheer in the lower-end models, too. Will rural demand improve and give a leg-up to lower-end models in the coming wedding season? Read this article from MCPro Research. The sales trajectory of CVs is closely tied to economic growth, where India is marching ahead of its peers. While the light commercial vehicle sales are yet to rev up, the explosive yoy growth of 20 per cent in medium heavy CVs is attributable to the infrastructure push and stable freight demand. Another key reason is that heavy pre-buying was witnessed before transition to OBD-2 norms (onboard diagnostic device), which is expected to get implemented from April 2023. The movers and shakers of this segment -- Tata Motors and Ashok Leyland -- have been posting strong sales numbers over several months. But there are headwinds that are gaining force. Will these derail auto recovery or moderate the pace of growth? While the agricultural outlook is positive, it is yet to reflect in small car and 2W sales numbers. Furthermore, the price increases on account of rising safety standards and higher interest rates are bound to hurt the lower-end models. A report by Motilal Oswal Financial Services quotes Shashank Srivastava, executive director of Maruti Suzuki as saying, “Market growth is likely to come down to 5-8 per cent due to several headwinds emerging on the horizon,” adding that recent price hikes are yet to impact demand, but post-February will be an interesting phase. In the retail market too, demand for lower end vehicles continues to drag as was the case in earlier months. So far, exports have been bleak as developed markets and some developing nations are battling their own internal fiscal and currency issues. In fact, the managements of some OEMs indicate that an export recovery may still be two to three quarters away. Investing insights from our research team Axis’ buy of Citi’s consumer business comes with minimum negative surprise El Nino Impact: Gainers and losers if monsoon fails Is it time to look at this quality chemical company? What else are we reading? Citibank’s failure to build an emotional bond with India will ensure it won’t be missed Why investors should not fear heat waves yet Chart of the Day: Financial conditions in EMs ease, but keep an eye on the dollar Startup Street | Is reverse flipping going to trend? Airlines defy gravity as economic gloom fails to bring them down to earth (republished from the FT) Can India's UPI become the payments system for the developing world? Banish those thoughts of LPG subsidy ending in the near term State capex falls short on sluggish execution. But ambitions soar Fed’s credibility can’t take a soft landing Technical Picks: Aluminium, UPL, JSW Steel, Maruti and HAL (These are published every trading day before markets open and can be read on the app). Vatsala Kamat Moneycontrol Pro"
15,2023-03-02 02:45:00,CEA Nageswaran says monthly data suggests FY23 GDP may be revised upwards,Data released earlier this week showed India's GDP growth rate fell to 4.4 percent in October-December,"India's high-frequency data suggests this year's GDP numbers may be revised upwards down the line, Chief Economic Adviser V Anantha Nageswaran said on March 2. ""Given the high-frequency indicators and the pace they are recovering, I believe current year data when revised next year would go upward rather than downward,"" Nageswaran said, pointing to indicators such as the manufacturing Purchasing Managers' Index and vehicle sales, among others. Nageswaran was speaking to reporters after the statistics ministry said on February 28 that the Indian economy expanded by 4.4 percent in October-December, down from 6.3 percent in July-September. Also read: India's economic growth slows down further to 4.4% in Dec quarter The 6.3 percent growth figure itself was less than half the 13.2 percent increase posted in April-June 2022 as the GDP growth rate benefitted from a low base in the early part of the year. ""It is not that the recovery is becoming weaker. Recovery will stabilise at some point because the base has become bigger and you will come to a steady growth rate in which medium-term factors will become important,"" the government's top economist said. Also read: FY23 GDP estimate: What's hot and what's not? The data released on February 28 also provided the second advance estimate for the full year's growth rate, which was retained at 7 percent. However, previous years' data saw some noteworthy revisions, which Nageswaran said adds noise to the data and makes any interpretation difficult. For instance, the GDP growth rates for 2019-20, 2020-21, and 2021-22 have been revised upwards to 3.9 percent, -5.8 percent, and 9.1 percent from 3.7 percent, -6.6 percent, and 8.7 percent, respectively. ""The data in India is not quarterly, seasonally adjusted. We need to look at three years' data from 2019-20 to 2022-23 for better comparison,"" Nageswaran said. The fall in the private final consumption expenditure growth to 2.1 percent from 8.8 percent in July-September has left economists worried. A contraction in the manufacturing sector's gross value added by 1.1 percent following a larger contraction in the previous quarter is also a concern. However, Nageswaran argued there is still pent-up demand in the system. ""We have been growing below potential in the last few years. The medium-term potential is between 6.5-7 percent as we have two important tail-winds in our favour - financial sector balance sheet, which is well prepared, and the digital public infrastructure,"" he added."
16,2023-03-02 01:54:00,Steps by Centre to increase exports by MSME sector: Official,"According to the MSME ministry, the market is getting bigger with the advancement of digital technologies and opening up of more export markets.","The Centre has taken steps to enhance exports by micro, small and medium enterprises (MSME) sector by setting up facilitation centers across the country, an official said on Thursday. The export facilitation centers will provide the requisite mentoring and handholding support to the sector and also help to set up a network of entrepreneurial leaders, the joint director of Indian Enterprise Development Service (IEDS) under the union MSME ministry, D Mitra told a seminar here, The Centre will also help the entrepreneurs of the sector to ensure marketability of their products and services by way of visiting and participating in seminars, exhibitions and conferences, he said. Support will also be given in areas like technology infusion, exploration of business opportunities and forging joint ventures, he said. According to the MSME ministry, the market is getting bigger with the advancement of digital technologies and opening up of more export markets. Mitra said this is the time to sensitise exporters about the present and future potential of export promotion for growing the business. The MSME ministry is working to make the units familiar with digital marketing, procure from Government E Marketplace and adapt to public procurement policy. According to government statistics, the share of MSME products in national exports is in excess of 34 per cent."
17,2023-03-02 02:11:00,Fed is set to hike rates to 6% or more. Will RBI follow suit?,Hopes of the Federal Reserve ‘pivot’ have faded on the back of robust economic data. Markets fear the Fed funds rate could rise to over 6 percent.,"While RBI Governor Shaktikanta Das says that the interest rate decisions of the rate-setting panel are determined primarily by domestic factors and not by what the Federal Reserve does, markets are increasingly expecting emerging market central banks to follow suit when the Fed raises rates over the coming months. February saw a sharp rise in US bond yields and the dollar and a sell-off in equities on the back of robust economic data. Markets now fear that the Fed funds rate could rise to over 6 percent from the current band of 4.50-4.75 percent. Remember, these rates were slashed to near zero after the pandemic hit. “As a result of employment, inflation and retail sales during the first half of February, markets have been forced to rethink their views on the Fed and recession,” Klaus Baader, Global Chief Economist at Societe Generale, said in a note. “Markets that prematurely expected a Fed pivot are now contemplating a fed funds rate of 6 percent or more.” At the end of January, the markets were pricing in a peak Fed rate of under 5 percent. Now, the US bond yield curve is more deeply inverted than at any time since the early 1980s. Also read: Uncertainties cloud global economy, G20 nations must resolutely address challenges: Shaktikanta Das While typically an inverted yield curve is seen as a sign of an impending recession, the curve has given false positives in the past and the time period between an inversion of the curve and the recession has varied, according to Jonas Goltermann, Deputy Chief Markets Economist at Capital Economics. To be sure, the market turned a deaf ear when the Fed said in December that its 2023 central projection for Fed rates was 5.1–5.4 percent. It is now listening and expects consecutive rate hikes. RBI action The Reserve Bank of India (RBI), geared as it says it is to domestic conditions, has also surprised the markets with a hawkish tilt recently. Rate hikes were expected to halt after the one in February but now economists expect them to continue. The minutes of the February monetary policy committee meeting showed that members were concerned about inflation amid uncertain geopolitical conditions, volatile crude prices, and weather-related risks. Two members, who voted against the 25 basis points rate hike, suggested that the panel wait for the impact of earlier rate hikes to play out and were worried about risks. “A hawkish RBI MPC stance will help counter the impact of any resultant jump in the US yields/ US dollar,” said Radhika Rao, Senior Economist – Eurozone, India, Indonesia. “The policy preference is to keep the currency at competitive levels vs regionals.” Also read: RBI's FY24 growth forecast seems to be backward-looking, says MPC's Ashima Goyal Rao expects a majority of the MPC to vote for a 25 basis points hike in April and keep the stance unchanged at ""withdrawal of accommodation"" and to then turn data dependent for future actions. As with the Fed, the RBI has also raised interest rates sharply since early 2022, reversing pandemic era ultra-easy policy. The RBI's benchmark repo rate has been raised from a record low of 4 percent to 6.5 percent. Late last year, economists had expected the so-called terminal repo rate to be at the current level but their projections have been thwarted by Fed action. UBS expects the MPC to be data dependent going forward and waits for February inflation data and Fed's March policy outcome to firm views on April policy."
18,2023-03-02 11:50:00,Banish those thoughts of LPG subsidy ending in the near term,"LPG subsidy is here to stay notwithstanding proclamations by successive governments to end it. This is because actions on the ground are driven by populism, not economics","In the Union Budget for 2023-24, finance minister Nirmala Sitharaman has kept the budget estimate (BE) for petroleum subsidy - primarily subsidy on liquefied petroleum gas (LPG) for household consumption - for 2023-24 at a mere Rs 2,257 crore. The subsidy on the purchase of a product is a financial assistance given by the state to persons who cannot afford to pay the market-based or cost-plus price. Subsidy on LPG is the excess of its cost of supply over the price paid by the beneficiary. The cost of supply is refinery-gate price, freight, marketing costs, marketing margin, dealers’ commission and taxes and duties. At present, 96 million poor households who have been provided free gas connection under the Pradhan Mantri Ujjwala Yojana (PMUY) during the last eight years or so are eligible to receive subsidy at the rate of Rs 200 per cylinder (14.2 kg) for 12 fills. The three major oil marketing PSUs - Indian Oil Corporation (IOC), Bharat Petroleum Corporation (BPCL) and Hindustan Petroleum Corporation (HPCL) - deliver the LPG cylinder to eligible beneficiaries at full cost-based price and follow it up by depositing subsidy in their account and claim reimbursement from the government of India (GoI). Small Outlay With the subsidy at Rs 200 per cylinder, the annual outgo on 12 fills in a year per beneficiary comes to Rs 2,400. For 96 million PMUY beneficiaries, the subsidy requirement will be Rs 23,040 crore. It may well be, the fills taken by the beneficiary are less; for instance, beneficiaries took four fills on an average during 2021-22. Even on this basis, the subsidy requirement would be Rs 7,680 crore annually. Against this, the Budget for 2023-24 has provided only Rs 2,257 crore. Does it give a signal that the government intends to completely exit subsidising LPG sooner than later? In June 2020, the LPG subsidy was stopped. That was due to the fortuitous circumstance of a steep decline in international prices (due to the COVID-19 pandemic) leading to a fall in price to Rs 600 a cylinder even on a cost-plus basis; hence subsidy support wasn’t required. The expenditure of Rs 36,000 crore under this head during 2020-21 was used largely to clear past dues of oil PSUs and provide free gas connections under PMUY. During 2021-22 when the international price rose due to waning COVID and demand revival, the retail price of LPG zoomed to over Rs 900 per cylinder. This led the government to restore subsidies, but only for PMUY beneficiaries. It spent Rs 14,000 crore during that year. During 2022-23, even as BE was kept at Rs 4,000 crore, it was increased to Rs 9,170 crore in the revised estimate (RE). Hidden Subsidy Additionally, from June 2020 to June 2022, the government had asked the three oil marketing PSUs to sell LPG at price below cost and gave them a one-time grant of Rs 22,000 crore to compensate for the losses incurred. This was nothing but subsidy (albeit ‘hidden’) given to all and sundry, and not just PMUY beneficiaries. Against this backdrop, the possibility of subsidy outgo during 2023-24 being substantially higher than BE cannot ruled out. Currently, when the cost of a cylinder is more than Rs 1,100 (in Delhi), a beneficiary won’t be satisfied with a subsidy of Rs 200 as she will still have to pay Rs 900 from her pocket. This will build pressure for increasing the subsidy, especially in view of impending elections. If it is increased to say Rs 600 (to ensure a price of Rs 500 per cylinder, being targeted by opposition-ruled states such as Rajasthan), the outgo even at 4 fills would be Rs 23,040 crore. The ball doesn’t stop here. The unfolding geo-political situation including the intensification of the Ukraine war, additional sanctions on Russia, increasing demand from China as it lifts COVID restrictions, etc will lead to the firming up of international prices of crude and LPG. Morgan Stanley has projected that the price of crude will rise to $110 per barrel in the second half of 2023. In turn, this would require a further increase in subsidy to ensure that the target price of Rs 500 per cylinder is maintained. Consequently, we could be staring at an expense much higher than 2022-23 RE of Rs 9,170 crore in the next fiscal; the precise level would depend on international price, the subsidy per cylinder, the number of beneficiaries and refills per beneficiary. The government will also spend Rs 30,000 crore, as already announced, by way of ‘capital support’ to the three oil marketing PSUs during 2023-24 to compensate for the losses incurred by them due to selling fuel at lower prices. To conclude, LPG subsidy is here to stay notwithstanding proclamations by successive governments to end it. This is because actions on the ground are driven by populism, not economics. Uttam Gupta is a policy analyst. Views are personal, and do not represent the stand of this publication.  "
19,2023-03-02 11:38:00,Will bank employees get five-day work week?,"While the Indian Banks’ Association has agreed, the government is to clear the proposal, as per sources.","Despite the consent of the Indian Banks’ Association (IBA) at the meeting with the United Forum of Bank Unions (UFBU), there is no clarity yet on a five-day work week for banking employees, according to people familiar with the development. “Things are still tentative and informal. IBA will consult with the government and then tell us. I would say no concrete development so far,” said one of the people quoted above on condition of anonymity. No circular yet At the meeting on February 28, 2023, there was a discussion on having uniform office hours from 9.50 am to 5.30 pm on all working days, cash hours from 10 am to 4 pm and customer services till 4.30 pm. It was agreed at that time that the introduction of a five-day banking week would be considered, the forum said. However, none of the participating organisations has made any written circular on the five-day work  week proposal said another person. “Generally we get minutes of the meeting but we have not gotten so far. We are still confused whether the pact has been signed between UFBU and IBA or not,” said the person. Long-pending demand Five-day work week is a long-pending demand of Indian bank employees, who started working on alternate Saturdays around eight years ago. Bank unions have been demanding since 2015 that they be given time off on all Saturdays and Sundays. In the 10th Bipartite Settlement signed in 2015, the IBA agreed after approval by the RBI and the government that second and fourth Saturdays would be holidays, according to the United Forum of Bank Unions, an umbrella body of nine national-level bank unions. The issue was taken up during the 11th Bipartite Settlement talks but could not be resolved. IBA and Bank unions negotiate salaries once every five years under the bipartite agreement. Other organisations Bank unions stepped up their demand for five-day work week after several other organisations followed the model. For instance, employees of Life Insurance Corporation of India switched to a five-day work week on May 10, 2021. Recently, the National Stock Exchange extended trading hours for interest rate derivatives till 5 pm, according to an official circular. The change in timing will come into effect from February 23. The trading window is now six hours and 30 minutes, stretching from 9 am to 3:30 pm. The decision to extend the time till 5 pm is intended to converge the trading hours with the underlying market timings, the exchange said."
20,2023-03-02 10:21:00,"Madhya Pradesh Budget: Industry bodies welcome it, Indore traders' association says it's aimed at 2023 polls","The state government presented a Rs 3.14 lakh crore Budget with a provision of Rs 8,000 crore for the 'Mukhyamantri Ladli Behna Yojana', a new scheme to be rolled out for the welfare of women in the state where the Assembly polls are due this year-end. Finance Minister Jadgish Devda presented the budget in the House.","Industry bodies in Madhya Pradesh welcomed the Budget 2023-24 presented by the state government on Wednesday, although a federation of business associations said there was nothing for the trading community in this ""election budget"". The state government presented a Rs 3.14 lakh crore Budget with a provision of Rs 8,000 crore for the 'Mukhyamantri Ladli Behna Yojana', a new scheme to be rolled out for the welfare of women in the state where the Assembly polls are due this year-end. Finance Minister Jadgish Devda presented the budget in the House. The Confederation of Indian Industry's (CII) Madhya Pradesh unit chairman Animesh Jain termed the budget as ""holistic and people-friendly"". ""We would also like to thank the state government for simplifying the regulatory compliance mechanism by discontinuing 131 redundant legal provisions and providing deemed approval for 35 essential services under the 'Start your business in 30 days' scheme,"" he said. Federation of Indian Chambers of Commerce and Industry (FICCI) state unit chairman Dinesh Patidar welcomed the ""green"" proposals in the budget. ""Due to the policy of scrapping old vehicles from roads, the use of environment-friendly electric vehicles will increase in the state,"" he said. The state government has proposed to implement the central policy of removing 15-year-old vehicles from roads and destroying them in a scientific manner from April 1. It said around 1,000 state-run government vehicles will cease to operate and they will be replaced by electric vehicles as a policy decision wherever possible. Yogesh Mehta, president of the Association of Industries of Madhya Pradesh, an industry organisation for the micro, small and medium enterprises (MSME) sector, described the state government's budget as ""development oriented for all sections"". He said that special emphasis has been laid on accelerating industrial investment in the budget. The proposal to develop 7,500 acres of land for a total of 14 new industrial areas, including two new Information Technology (IT) parks in the state, was a far-reaching step that would generate employment. However, Ramesh Khandelwal, president of Ahilya Chamber of Commerce, a federation of Indore-based traders associations, termed the budget as an ""election budget"". ""There is nothing in this budget for the traders' community,"" he said. ""The huge provision of Rs 8,000 crore for Mukhyamantri Ladli Behna Yojana in the budget is an exercise aimed at wooing women voters ahead of the assembly elections due later this year,"" Khandelwal added."
21,2023-03-02 10:15:00,El Nino Impact: Gainers and losers if monsoon fails,"Deficient rains can be a bane for agri- and rural-centric companies, while proving to be a boon for sectors that offer respite from scorching heat","                        Highlights

	Probability of El Nino and sub-par rains
	Deficit rain years haven’t been good for equity markets
	Agrochemicals, tractors, 2W, rural-centric FMCG, and retail to face the heat
	A few winners such as cold beverages, aircon, coal, thermal power, and power exchange

India has come a long way to reduce its over dependence on the agrarian sector with a sharp spurt in the share of services. Nevertheless, come late spring, all eyes will be on the monsoon forecast. Although agriculture accounts for around 19...
                    "
