,Time,Title,Description,Body
0,2023-03-03 09:21:00,India commercial paper rates may rise further as liquidity dries up: Analysts,"Short-term rates, which have been edging higher since the Reserve Bank of India started raising rates last year, have already hit their highest level in over four years because the liquidity deficit in the banking system is seen widening and the government has stepped up borrowing via treasury bills at the end of the financial year.","Indian companies may have to spend more to raise short-term funds via commercial papers as liquidity tightens further and government borrowings of similar tenure increase, analysts said. Short-term rates, which have been edging higher since the Reserve Bank of India started raising rates last year, have already hit their highest level in over four years because the liquidity deficit in the banking system is seen widening and the government has stepped up borrowing via treasury bills at the end of the financial year. Earlier this week, state-run financial institution NABARD raised three-month funds at 7.65%, which was over 40 basis points higher than what it paid for a similar paper a month ago. Shadow lenders Bajaj Finance, Aditya Birla Finance and Tata Capital Financial, which are regular issuers, paid 7.84%-7.90% for a three-month paper, up 20-30 bps in the last two weeks. These rates are at the highest level since October-November 2018. ""We were already seeing a rise in rates of commercial papers, and companies will have to shell out even more with tighter liquidity conditions likely in March,"" said Anand Nevatia, fund manager with Trust Mutual Fund. The Refinitiv benchmark CP index for non-bank financial companies, which are the largest borrowers in the CP market, showed that the rates have jumped to their highest levels since March 2020, when the pandemic hit. Barring the pandemic period, the rates are at the highest since November 2018. (Graphic: Commercial paper rates have risen to near 4-year highs Commercial paper rates have risen to near 4-year highs, https://www.reuters.com/graphics/INDIA-MARKETS/egpbyolbxvq/chart.png) The recent jump in CP rates is seen across categories, with even top-rated companies paying more, market participants said. ""Since the current rise in yields is more due to broader factors and not any sector or a company-specific issue, we are seeing a uniform jump,"" said Venkatakrishnan Srinivasan, founder and managing partner of debt advisory firm Rockfort Fincap. ""The three-month CP rates of highly rated companies may remain above 7.75%, while the one-year rates may linger around 8.25%, unless the RBI induces more liquidity in the system,"" Srinivasan said. New Delhi is set to borrow an additional 500 billion rupees ($6.06 billion) through a sale of Treasury Bills in March. Banking system liquidity stayed in deficit for most of February and could spiral down with advance tax and GST payments. ""We have seen short-term yields soaring because of tightening liquidity and recent higher inflation prints which have led to market disagreement on terminal rate expectations,"" said Sanjay Pawar fixed income fund manager at LIC Mutual Fund."
1,2023-03-03 09:19:00,Personal Finance: Tackling unprecedented situations in financial planning,Unprecedented situations in one’s life can disrupt financial stability ,"                        An investor who meticulously follows the financial planning process is usually aware that it is a road to achieving financial goals. That is the main motive of this process. The conventional financial goals that we keep hearing about are retirement planning, children’s higher education goal, children’s marriage goal, planning for a house purchase, etc.

But some unprecedented financial situations take us completely off-guard and often rock the stability of personal finances. These could be termed ‘unconventional’ financial goals. A few...
                    "
2,2023-03-03 09:00:00,Will G20 pay heed to Narendra Modi’s wake-up call?,The outcome of the G20 foreign ministers’ meeting underscores the crisis that multilateralism faces in today’s world,"                        Highlights

	G20 foreign ministers fail to issue a joint statement
	The chair summary is very similar to the one issued last week after G20 financial leaders’ huddle
	G20 is unable to exorcise the ghost of the Ukraine war
	The deep divide between the West and the Russia-China combine remains
	 India wants to put war worries behind and push its agenda during the G20 presidency
	But New Delhi has its compulsions and doesn’t wield that influence on the global stage
	Taking a cue from Modi’s remark, India...
                    "
3,2023-03-03 08:48:00,India at last gets going on drug regulatory reforms,"After the initial gut reactions of denial, better sense now seems to be prevailing and the conclave bringing together all stakeholders, regulatory organisations and senior officials running them is a move in the right direction ","                        It has taken the authorities several months after the death of children in two countries being linked to taking cough syrup made in India to do what is critically needed – bring together the key stakeholders in the pharmaceutical industry and the regulators so as to devise a pathway to building a robust regulatory system that does not again let the country down. The critical issue of safety of Indian drugs persists, with the USFDA warning earlier this month...
                    "
4,2023-03-03 08:48:00,Investors want SBI Cards to make the most of growing credit card spends,"Despite SBI Cards performing well with its loan book expanding and asset ratios getting better, investors have been lukewarm on the stock","                        By Alekh Angre

Highlights

	SBI Cards accounts for nearly a fifth of outstanding cards and spends in the industry
	It led the industry in new card additions on a net basis in January 2023
	Asset quality has improved
	RBI’s tightening of regulations has been weighing on the stock
	Hardening of interest rates has led to cost of funds rising
	Another pain point for investors has been the stagnant share of revolvers in gross receivables
	Digital lending platforms are gaining popularity, offering competition to credit cards

SBI Cards and Payment...
                    "
5,2023-03-03 09:00:00,Are retail investors losing faith?,"Last month, institutional investors were net buyers of Indian stocks worth more than Rs 8,000 crore. But still, Nifty cracked by more than 2 percent during the period -- in other words, February saw retail investors losing faith ","                        Highlights

	Easy money and extraordinary returns, coupled with rising incomes in the Technology sector had contributed to an exponential rise in the appeal of stock markets for retail investors
	Retail investors’ contribution to turnover in NSE rose to a decade-high of 45percent in FY21
	DIIs and retail investors continued to support the stock markets, which helped Nifty hold its ground around the 18,000 levels
	In January, direct retail participation in equities started dipping
	Indirect retail participation via SIPs continued unabated even in January
	The ongoing...
                    "
6,2023-03-03 08:18:00,Salvatore Babones writes: India will never achieve the kind of manufacturing dominance that China once had,"More efficient agriculture and services can do just as much to promote growth as more efficient manufacturing. And unlike manufacturing, agriculture and services depend relatively little on global markets","India will soon have a $5 trillion economy, en route to $10 trillion by 2040. That trajectory puts India on track to surpass China in total GDP by mid-century. It will take a lot of ambition – buttressed by strong execution –  to make that future a reality. But it is doable, and the geopolitical outlook is benign. If there's one thing the rest of the world wants, it's an Asian alternative to China. But India is unlikely to grow its way to global influence through export-driven manufacturing for the US and European markets. That trick has been done once, and it won't be done again. From Scale To Redundancy Global manufacturing supply chains became concentrated in China as formerly American production was offshored first to Japan, then to South Korea and Taiwan, and finally from there to China. These production networks consolidated massive manufacturing clusters on a scale never seen before. But today the trend is toward redundancy and supply chain security. That's not just a passing fashion. Modern twenty-first century production networks are not driven by the same economy-of-scale logic that dominated the last century. For high-value components in particular, continuity of supply can be more important than simple low-cost. As a result, production networks are now diversifying out of China. India will capture some of that diversification, but it will never achieve the kind of manufacturing dominance that China once had. And without that kind of dominance, India can't manufacture its way to middle-income status. Luckily, it doesn't have to. Growth Beyond Manufacturing Economic growth isn't just about manufacturing. China's growth was centred on export manufacturing because when China opened to the West, it initially kept its domestic sectors closely guarded. Only the export sector was liberalised, and the export sector quickly adjusted to global levels of productivity. The rest of the economy stayed relatively poor. Thus, although China is a globally-competitive centre for manufacturing, its agriculture and services sectors remain productivity laggards. The overall productivity of an economy, which ultimately determines a country's GDP per capita, is the weighted average of the level of productivity of every sector in the economy. In China's case, manufacturing boosts GDP per capita, while other sectors drag it down. India's path to middle-income status likely does not involve it ever becoming the workshop of the world. Instead, India is more likely to become an $8,000 GDP per capita like Brazil, where exports account for around 20 percent of GDP and manufacturing accounts for only 10 percent of GDP, lower than India's 15 percent. There are many paths to productivity. Focus On Productivity With 30 percent more arable land than in China and more than 40 percent of its workforce still engaged in agriculture, the fastest way to increase productivity (and thus GDP) in India would be to improve the productivity of Indian agriculture. This would require major reforms, but every path to growth requires major reforms. India could become an agricultural powerhouse like Brazil, but only if it ends wasteful practices associated with the mandi system and moves decisively toward market-driven commercialised agriculture. India's services sector would also benefit from continued deregulation. Software services may be a leading sector in India, but other service industries are held back by the dead hand of unnecessary regulation and superfluous red tape. It shouldn't be so complicated to get things done in India. Any paperwork that exists purely for the sake of generating paperwork should simply be eliminated. Market-oriented reforms can be scary (and sometimes politically unpopular), but they are necessary, and will ultimately benefit everyone. If India wants to grow, it will have to move to an economy that has fewer low-productivity farmers and fewer low-productivity servants. Middle-class Indians can't have cooks, cleaners, and drivers. If they do, India's middle class will remain small—and India will remain poor. Reforms that pull people off the farm (and out of the house) inevitably raise the spectre of mass unemployment. But in all of history, that spectre has never materialised. Today's developed economies also used to have millions of poor farmers and domestic servants. Rising productivity created new, better opportunities for these people and their descendants. Productivity really is the tide that lifts all boats. More efficient agriculture and services can do just as much to promote growth as more efficient manufacturing. And unlike manufacturing, agriculture and services depend relatively little on global markets. To reach middle-income status through export-driven manufacturing growth, India will have to beat out many cut-throat competitors. Dozens of countries want to be the next workshop of the world, and they're all going to have to share a slowly expanding pie. But productivity gains in agriculture and services are entirely under India's own control. It would be foolish not to pursue them. Salvatore Babones is an associate professor at the University of Sydney and director of the Indian Century Roundtable. Views are personal, and do not represent the stand of this publication."
7,2023-03-03 06:29:00,Cash Market | GoldBees may do well if dollar index falls,The stock is firmly in an uptrend and one should look for dips to enter,
8,2023-03-03 06:26:00,Commodity Trade | Bear sash near resistance indicates correction in Copper,Lower high and loss of momentum support the bearish view on Copper,
9,2023-03-03 06:22:00,Options Trade | A non-directional options strategy in Axis Bank,Axis Bank is expected to remain sideways within our range. An Iron Condor trade to capitalise,
10,2023-03-03 06:19:00,Cash Trade | Asian Paints: Price is breaking out of a double bottom trend reversal pattern,Breakout is on strong volumes and MACD is in a buy mode.,
11,2023-03-02 06:26:00,G20: Russia-Ukraine proves obstacle to joint statement as India issues Chair's Summary again,"According to External Affairs Minister S Jaishankar, there was agreement on around 95 percent of issues among the G20 foreign ministers","The Russia-Ukraine issue proved a gap too far to bridge for the G20 foreign ministers as India was forced to issue a Chair's Summary and Outcome Document for the second meeting in a row. ""There were a very large number of issues on which there was agreement,"" External Affairs Minister S Jaishankar said in a briefing on March 2. ""There was a considerable meeting of minds... If we had had a perfect meeting of minds on all issues and captured it fully, then obviously it would have been a collective statement. But there were issues...concerning the Ukraine conflict, on which there were divergences,"" Jaishankar added. The issuance of a Chair's Summary and Outcome Document at the end of the Foreign Ministers' Meeting follows a similar conclusion last week after the meeting of Finance Ministers and Central Bank Governors was also unable to reach a consensus over a communique, or a joint statement, due to opposition from Russia and China over the characterisation of the conflict in Ukraine. Last week's meeting in Bengaluru ended with the Chair's Summary adopting two key paragraphs from the Bali Leaders' Declaration, which said most members condemned Russia for the war, while other members had differing views and assessments of the situation. Russia and China had then voiced their opposition to the inclusion of these two paragraphs, which was mentioned in a footnote. Jaishankar said today that apart from two paragraphs in the Chair's Summary, there was consensus among the G20 members on the rest of the document. The Chair's Summary issued at the end of the meeting of the foreign ministers on March 2 also took the same two paragraphs from the Bali Leaders' Declaration. In his briefing today, Jaishankar said he had mentioned in one of the sessions today that for the Global South, the Russia-Ukraine conflict was a make-or-break issue. Also Read: G20 must provide direction to world: EAM Jaishankar Also Read: G20 Summit: PM Modi urges foreign ministers to not let difficult issues block others In addition to his discussions with G20 members, Jaishankar said he had also met with China's foreign minister, with the bulk of the conversation surrounding concerned the bilateral relationship, which Jaishankar has previously described as ""abnormal"". Day 2 of G20 foreign ministers' meet in pics ""There are real problems in that relationship, that need to be looked at, that need to be discussed very openly and candidly between us,"" Jaishankar said, adding that these discussions included ""peace and tranquillity along the border""."
12,2023-03-02 05:38:00,"How Warren Buffett turned a few calls into 3,787,464%",A good decision every five years provided the foundation of Berkshire Hathaway’s returns,"Few investors’ words are parsed more intently than Warren Buffett’s. But in this year’s annual shareholder letter, which dropped Saturday, the Oracle of Omaha didn’t give much away. It was one of his shortest ever and contained few fresh ideas. But he did offer one morsel: “Our satisfactory results,” he wrote, “have been the product of about a dozen truly good decisions – that would be about one every five years.” By “satisfactory results,” Buffett is being modest. Shares in his investment vehicle, Berkshire Hathaway Inc., have returned 3,787,464% over his almost six decades at the helm. That just 12 decisions drove such performance is remarkable. Naturally, investors scrambled to identify them. For my part, the list can be narrowed down even more. Chief among them has to be the acquisition of National Indemnity, which forms the kernel of the insurance segment that now contributes about half of Berkshire’s total assets. Headquartered a few blocks away from Berkshire in Omaha, Nebraska, Buffett acquired the business in 1967 for $8.6 million. With it came a captive investment portfolio that in 1967 sat on $174,000 of gains; by the end of 1968 – Buffett’s first full year of ownership – it was sitting on $1.76 million. The acquisition sparked Buffett’s love affair with “float.” His biographer Alice Schroeder remarks: “To someone like Buffett, having other people’s money to invest, on which he kept the profit, was catnip.” Float arises because most insurance policies require that premiums be prepaid and because it usually takes time for an insurer to hear about and resolve claims; in the meantime, insurers get to invest the capital for their own benefit. “This access to ‘free’ money has boosted Berkshire's performance in a major way,” wrote Buffett in his 1995 shareholder letter. Berkshire’s latest annual report (page K-98) illustrates the point. In Berkshire Hathaway Primary Group, where National Indemnity now resides, over half of the claims are paid out more than three years after an accident. In one case (highlighted on page K-99) National Indemnity booked a $10.2 billion premium back in 2017 on which it has so far only paid out $2.7 billion. Last year, the overall cost of float was nominal; in prior years it has been negative. Over the years, “through acquisitions, operations and innovations,” Berkshire has bolstered its float. From $39 million in 1970, the group’s overall float now stands at $164 billion. Last year alone, it grew by $17 billion, partly from the acquisition of Alleghany Corp. By itself, the Alleghany deal was too small to be one of the dozen, but another insurance acquisition does make the cut: Geico. Buffett had been following Geico for at least 25 years before he acquired a third of the company in 1976. Over the next 10 years, it grew to account for half of his public stock portfolio. In 1995, he took full control. Not only did Geico contribute $3 billion to the group’s float but, unlike other insurance companies, it made money along the way via positive underwriting results. Despite a setback last year when it suffered losses as claims shot up, cumulative underwriting profits have amounted to $19.8 billion – not bad for an acquisition whose all-in cost was around $2.4 billion. Other insurance acquisitions were less accretive. In 1998, Berkshire acquired General Re Corp, which came with $14 billion of float but a heap of problems. Buffett wrote in his 2002 letter that the company had “severely miscalculated the cost of the product it was selling.” A greenfield investment in reinsurance years earlier also failed, highlighting the risks inherent in sourcing float. “After more than 20 years, [we] regularly receive significant bills stemming from the mistakes of that era,” Buffett wrote of the scheme in his 1995 letter. “A bad reinsurance contract is like hell: easy to enter and impossible to exit.” Neither General Re nor Berkshire’s organic foray into reinsurance make it into the dozen. Fortunately, one key decision helped to resolve these mistakes: the hiring of Ajit Jain, currently Berkshire’s vice chairman of insurance operations. “The search expenses that brought us Ajit Jain, now there was an investment that really paid a dividend,” said Berkshire Vice Chairman Charlie Munger at the group’s 2005 annual meeting. “I can think of no higher return investment that we’ve ever made that was better than that one.” Jain came in to run Berkshire’s reinsurance business and then launched a new business, “catastrophe insurance,” in which the group is now the world leader. He’s “added tens of billions of value,” said Buffett at his 2017 annual meeting. The Jain hire together with the National Indemnity and Geico acquisitions represent a quarter of the “dozen truly good decisions” Buffett has made, but more than that, they define the structure of the Berkshire Hathaway group. Many of the other decisions are intertwined with them, including the purchase of Coca-Cola Co. stock, a slug of which is held via Geico’s float. Distilling 58 years of work down to 12 decisions is hard, but that level of endurance requires a firm foundation. How that foundation is set up is perhaps the most important decision of all. Marc Rubinstein is a former hedge fund manager. Views are personal and do not represent the stand of this publication. Credit: Bloomberg"
13,2023-03-02 05:23:00,Ajay Banga's experience will stand him in good stead at World Bank: FinMin,"""Congratulations to Ajay Banga on being nominated to lead World Bank. India supports Banga's nomination and looks forward to his leadership of the World Bank,"" the Finance Ministry said in a tweet.","The Finance Ministry on March 2 congratulated and supported the nomination of Indian-born former Mastercard CEO Ajay Banga to head the World Bank. ""Congratulations to Ajay Banga on being nominated to lead World Bank. India supports Banga's nomination and looks forward to his leadership of the World Bank,"" the Finance Ministry said in a tweet. Banga brings with him unique and wide-ranging expertise in the financial and technological sectors. ""He has rich experience in guiding large organisations that have invested and created jobs in developing economies, and in mobilising resources on a large scale,"" FinMin said. Banga's rich experience will stand him in good stead at a time when the World Bank is considering next-generation reforms to deliver on its ambitious agenda to reduce poverty, expand prosperity and deal with the pressing global challenges of our times, the tweet said."
